id;spec;job_title;city;employer;schedule;skills;experience;published;salary_from;salary_to;currency
79717968;Финансовый аналитик;Кредитный аналитик в финансовую компанию Umnozhenie (удаленно);Казань;Солодянкин Клим Игоревич;;работа с банками, срм, анализ текущих финансовых показателей, навыки эффективного общения, достижение результата, системное мышление, работа с документами;От 1 года до 3 лет;2023-04-27;113000;289000;RUR
79370981;Финансовый аналитик;Финансист-аналитик/Финансовый директор;Казань;АНП Зенит;;power bi, аналитическое мышление, ms powerpoint, управленческая отчетность, финансовая отчетность;От 3 до 6 лет;2023-04-26;150000;;RUR
79086010;Финансовый аналитик;Финансовый аналитик;Набережные Челны;НАХОДКА;;;От 1 года до 3 лет;2023-04-27;70070;;RUR
79819451;Финансовый аналитик;Финансовый аналитик;Казань;Savage;;управленческая отчетность, 1c: финансы, финансовая отчетность, умение организовывать работу, планировать, работа в команде;От 3 до 6 лет;2023-04-26;;;
79910175;Финансовый аналитик;Финансовый аналитик;Казань;ВТС;;финансовый анализ, ms powerpoint, управленческий учет, 1с: предприятие 8, экономический анализ;От 3 до 6 лет;2023-04-28;60000;;RUR
79910718;Финансовый аналитик;Финансовый аналитик;Казань;Абдуллина Алсу Ренатовна;;экономическое моделирование, анализ инвестиционных проектов, аналитические исследования, анализ финансовых показателей, бизнес-планирование, альт-инвест, анализ текущих финансовых показателей, подготовка презентаций, английский язык;От 1 года до 3 лет;2023-04-28;55000;60000;RUR
79922046;Финансовый аналитик;Финансовый аналитик;Набережные Челны;Группа Бринэкс;;;От 1 года до 3 лет;2023-04-28;;90000;RUR
79616396;Финансовый аналитик;Младший финансовый аналитик (удаленно);Набережные Челны;Моё дело;;финансовый анализ, анализ текущих финансовых показателей, обучение и развитие, экономический анализ, linux;От 1 года до 3 лет;2023-04-20;40000;;RUR
79021093;Финансовый аналитик;Финансовый аналитик со знанием английского языка;Казань;Картли;;английский язык, финансовый анализ, ms powerpoint, управленческая отчетность, финансовая отчетность;Нет опыта;2023-04-26;70000;;RUR
79598018;Финансовый аналитик;Финансовый аналитик;Казань;Factory5;;финансовый анализ, экономический анализ, экономическое моделирование;От 1 года до 3 лет;2023-04-20;;;
78195244;Финансовый аналитик;Финансовый аналитик;Казань;БАНК КАЗАНИ, КБЭР;;кредитные договоры, анализ финансовых показателей, ms access, 1c: финансы, анализ текущих финансовых показателей;От 1 года до 3 лет;2023-04-26;;;
79402894;Финансовый аналитик;Финансовый аналитик;Казань;Картли;;финансовый анализ, ms powerpoint, управленческая отчетность, финансовая отчетность;Нет опыта;2023-04-17;50000;;RUR
79360961;Финансовый аналитик;Accountant / Financial analyst;Казань;PropVue LLC;;бухгалтерский учет, английский язык, формирование управленческой отчетности, работа с большим объемом информации, финансовый менеджмент, аналитическое мышление, анализ финансовых показателей, анализ бизнес показателей, налоги, business english, финансовая отчетность, финансовый контроль, тайм-менеджмент, управленческая отчетность;От 3 до 6 лет;2023-04-17;90000;;RUR
78808960;Финансовый аналитик;Аналитик (Финансовый блок операционных расходов);Казань;МАГНИТ, Розничная сеть;;работа с большим объемом информации, финансовая отчетность, план-фактный анализ бюджета, продвинутый пользователь ms excel, анализ финансовых показателей;От 1 года до 3 лет;2023-04-03;;70000;RUR
79606336;Финансовый аналитик;Финансовый аналитик;Ижевск;Авто Столица;;;От 3 до 6 лет;2023-04-20;60000;;RUR
79859939;Финансовый аналитик;Финансовый аналитик;Ижевск;Калашников;;;От 3 до 6 лет;2023-04-27;;;
79908798;Финансовый аналитик;Финансовый аналитик;Чебоксары;Гарантийный фонд Чувашской Республики;;анализ финансовых показателей, работа с юридическими лицами, финансовая отчетность, исполнение поручений руководителя, контроль оформления документов, составление договоров, финансовый анализ, деловая переписка, ведение переговоров, подготовка отчетов, деловая этика, коммуникабельность, ответственность;От 3 до 6 лет;2023-04-28;35000;40000;RUR
78995549;Финансовый аналитик;Финансовый аналитик;Чебоксары;Консалтинговое агентство Бизнес-Альянс;;;Нет опыта;2023-04-19;35000;38000;RUR
77886078;Финансовый аналитик;Финансовый аналитик;Иркутск;СТЭС;;;От 3 до 6 лет;2023-04-28;80000;;RUR
79412841;Финансовый аналитик;Финансовый аналитик (экономист);Иркутск;Смагина Александра Владимировна;;сводные таблицы, стратегическое мышление, аналитическое мышление, экономический анализ, анализ финансовых показателей, составление бизнес-плана, аналитика, управление рисками, креативность, 1c: финансы, тайм-менеджмент, опытный пользователь пк, творчество, умение анализировать, умение легко находить контакт с людьми, внимательность к мелочам, решение нестандартных задач, финансовый анализ, анализ текущих финансовых показателей, контроль и анализ ценообразования, план-фактный анализ бюджета;От 3 до 6 лет;2023-04-17;100000;;RUR
79412810;Финансовый аналитик;Финансовый аналитик (инвестиционное планирование);Иркутск;Смагина Александра Владимировна;;аналитическое мышление, экономический анализ, анализ финансовых показателей, стратегическое мышление, аналитика, сводные таблицы, excel, финансовый анализ, внутренний финансовый аудит, план-фактный анализ бюджета;От 1 года до 3 лет;2023-04-17;;;
79074166;Финансовый аналитик;Руководитель проекта/Финансовый аналитик;Братск;Бизнес Ай Ти;;лидерство, crm, внедрение, системное мышление, стратегическое мышление, аналитическое мышление, управление офисами компании, тайм-менеджмент, высокий уровень самоорганизации, управление проектами, обучение и развитие, аналитические навыки, работа в команде;От 1 года до 3 лет;2023-04-27;69000;109000;RUR
79930072;Финансовый аналитик;Финансовый аналитик (оптимизация);Красноярск;Смагина Александра Владимировна;;анализ бизнес показателей, 1c: предприятие, знание 1с, управление финансами, многозадачность, 1c: финансы, 1с: унф, финансовое планирование, финансовая отчетность, бизнес-планирование, работа с большим объемом информации, системное мышление, умение принимать решения, аналитическое мышление, экономический анализ, анализ финансовых показателей, аналитика, стратегическое мышление, составление бизнес-плана, анализ текущих финансовых показателей, excel, сводные таблицы, опытный пользователь пк, бюджетирование, инвестиционный анализ, инвестиционное планирование, управление рисками, управленческая отчетность, финансовый анализ, финансовый контроль;От 3 до 6 лет;2023-04-28;;120000;RUR
79638253;Финансовый аналитик;Финансовый аналитик в Головной офис;Красноярск;Гармония Здоровья;;ms outlook, ms powerpoint, 1с: предприятие 8, управленческая отчетность, финансовая отчетность;От 1 года до 3 лет;2023-04-21;50000;65000;RUR
79001081;Финансовый аналитик;Финансовый аналитик / начинающий специалист;Красноярск;Совкомбанк;;подготовка презентаций, деловая коммуникация, деловая переписка, деловое общение, английский язык;Нет опыта;2023-04-28;40000;;RUR
79585306;Финансовый аналитик;Финансовый аналитик в г. Владивосток;Красноярск;Русская Рыбопромышленная Компания;;бюджетирование, план-факторный анализ, расчет kpi, бизнес-планирование, базы данных, бдр, бддс, ms excel, power pivot, power query, power bi, 1 с, управленческий учет, cima;От 3 до 6 лет;2023-04-20;;;
78925242;Финансовый аналитик;Аналитик финансово-экономического отдела;Киров (Кировская область);УФСИН России по Кировской области;;;Нет опыта;2023-04-05;20000;;RUR
79812994;Финансовый аналитик;Бизнес-аналитик / Финансовый аналитик;Нижний Новгород;Биохимический холдинг «Оргхим»;;анализ финансовых показателей, план-фактный анализ бюджета, прогнозирование, финансовое моделирование, факторный анализ, бизнес-моделирование, английский язык;От 1 года до 3 лет;2023-04-26;;;
78904715;Финансовый аналитик;Финансовый аналитик;Нижний Новгород;Sigmart;;аналитика, экономический анализ, сводные таблицы, google таблицы, анализ рынка, аналитические исследования, анализ данных, анализ финансовых показателей, подготовка отчетов, инвестиционная деятельность, баланс, аналитическое мышление, дебиторская задолженность, кредиторская задолженность, финансовый анализ, анализ текущих финансовых показателей, план-фактный анализ бюджета;От 1 года до 3 лет;2023-04-28;48000;61000;RUR
79857353;Финансовый аналитик;Аналитик службы финансового менедмента;Нижний Новгород;СБЕР;;;От 1 года до 3 лет;2023-04-27;;;
79734609;Финансовый аналитик;Финансовый аналитик;Нижний Новгород;Сеть ювелирных салонов Сенат;;финансовый анализ, анализ текущих финансовых показателей, управление персоналом, 1с: предприятие 8, бюджетирование, бизнес-планирование, 1с: комплексная автоматизация, excel, сводные таблицы, работа в программе 1с, планирование, способность работать в режиме многозадачности, аналитическое мышление, аналитические навыки, желание работать и развиваться, энтузиазм, внешний финансовый аудит, внутренний финансовый аудит, план-фактный анализ бюджета;От 1 года до 3 лет;2023-04-28;;;
79757644;Финансовый аналитик;Финансовый менеджер-аналитик;Нижний Новгород;Клюева Анна Владимировна;;;От 1 года до 3 лет;2023-04-25;50000;60000;RUR
79520452;Финансовый аналитик;Финансовый аналитик;Богородск;НижегородАвтоДор;;сводные таблицы, анализ данных, работа с большим объемом информации, финансовое планирование, финансовый контроль, аналитическое мышление, работа с банками, продвинутый пользователь excel, ответственность и пунктуальность, план-фактный анализ бюджета;От 3 до 6 лет;2023-04-19;50000;;RUR
79313992;Финансовый аналитик;Финансовый аналитик (Junior);Нижний Новгород;YADRO;;;От 1 года до 3 лет;2023-04-21;;;
79520451;Финансовый аналитик;Финансовый аналитик;Кстово;НижегородАвтоДор;;сводные таблицы, анализ данных, работа с большим объемом информации, финансовое планирование, финансовый контроль, аналитическое мышление, работа с банками, продвинутый пользователь excel, ответственность и пунктуальность, план-фактный анализ бюджета;От 3 до 6 лет;2023-04-19;50000;;RUR
76450235;Финансовый аналитик;Ведущий финансовый аналитик;Нижний Новгород;Нижегородская Фитнес Группа (сети фитнес-клубов World Class и ФизКульт);;дебиторская задолженность, кредиторская задолженность, финансовый анализ, анализ текущих финансовых показателей, внешний финансовый аудит;От 3 до 6 лет;2023-04-25;;;
76727479;Финансовый аналитик;Финансовый аналитик (коммерческий контроллинг);Нижний Новгород;МТС;;npv, инвестиционные риски, анализ финансовых показателей, оценка инвестиционных проектов, финансовый анализ;От 1 года до 3 лет;2023-04-24;;;
79520450;Финансовый аналитик;Финансовый аналитик;Нижний Новгород;НижегородАвтоДор;;сводные таблицы, анализ данных, работа с большим объемом информации, финансовое планирование, финансовый контроль, аналитическое мышление, работа с банками, продвинутый пользователь excel, ответственность и пунктуальность, план-фактный анализ бюджета;От 3 до 6 лет;2023-04-19;50000;;RUR
78608318;Финансовый аналитик;Финансовый менеджер-аналитик;Нижний Новгород;Группа ГАЗ;;;Нет опыта;2023-04-24;;;
78795026;Финансовый аналитик;Финансовый аналитик/менеджер в г. Сухум (Абхазия);Нижний Новгород;Салоны мебели и интерьера Домино;;;От 1 года до 3 лет;2023-04-01;70000;110000;RUR
75943347;Финансовый аналитик;Финансовый аналитик/экономист;Нижний Новгород;Драйлок Текнолоджиз;;анализ текущих финансовых показателей, экономический анализ, анализ затрат, анализ себестоимости, расчет себестоимости, бюджетирование, ms excel, ms powerpoint, расчет и анализ себестоимости продукции и услуг, финансовый анализ, cash flow, английский — b1 — средний, анализ финансовых показателей;От 1 года до 3 лет;2023-04-22;;;
70396396;Финансовый аналитик;Финансовый аналитик (Хайджин);Нижний Новгород;АНО Областное кадровое агентство;;английский язык, грамотная речь, обучение и развитие, корпоративная этика;От 1 года до 3 лет;2023-04-19;45000;;RUR
77131528;Финансовый аналитик;Финансовый аналитик (г. Владимир);Нижний Новгород;Abi;;факторный анализ, анализ себестоимости, планирование, экономический анализ;Нет опыта;2023-04-10;;;
78818275;Финансовый аналитик;Финансовый аналитик;Нижний Новгород;Корпорация развития Нижегородской области;;расчет финансовых показателей, оценка инвестиционных проектов, расчет срока окупаемости, чистый дисконтированный доход, внутренняя норма прибыльности;От 3 до 6 лет;2023-04-03;;;
79391765;Финансовый аналитик;Экономист/Аналитик в финансово-экономический отдел;Рязань;Everest Partner;;ведение отчетности, подготовка отчетов, расчет и анализ себестоимости продукции и услуг, опытный пользователь пк;Нет опыта;2023-04-21;;;
79891448;Финансовый аналитик;Финансовый аналитик (большие базы данных);Бийск;Всесезонный курорт Манжерок;;;От 3 до 6 лет;2023-04-27;;;
79293238;Финансовый аналитик;Специалист по финансовому анализу инвестиционных проектов;Новокузнецк;СГМК;;бюджетирование, планирование, управленческая отчетность, финансовое моделирование, факторный анализ;От 1 года до 3 лет;2023-04-24;;;
79830976;Финансовый аналитик;Финансовый аналитик;Новосибирск;VILAVI;;анализ текущих финансовых показателей, ms powerpoint, финансовая отчетность, аналитическое мышление, анализ данных, работа в команде, проектная деятельность, мсфо, вэд, гибкость, умение доносить простым языком сложные вещи, навыки презентации, желание оптимизировать процессы без потери качества, финансовый анализ, управление персоналом;От 3 до 6 лет;2023-04-26;70000;;RUR
79891447;Финансовый аналитик;Финансовый аналитик (большие базы данных);Новосибирск;Всесезонный курорт Манжерок;;;От 3 до 6 лет;2023-04-27;;;
79776096;Финансовый аналитик;Финансовый аналитик;Новосибирск;СЗ АКВА СИТИ;;;От 3 до 6 лет;2023-04-28;;;
79039036;Финансовый аналитик;Финансовый аналитик;Новосибирск;2ГИС;;;От 1 года до 3 лет;2023-04-27;;;
79855190;Финансовый аналитик;Финансовый аналитик;Новосибирск;Новосибирскэнергосбыт;;собеседование, power point, 1c: предприятие, аналитическое мышление, экономический анализ, сбор и анализ информации, экономика, анализ финансовых показателей, прогнозирование, финансовое планирование, финансовая отчетность;От 1 года до 3 лет;2023-04-27;41500;;RUR
78587841;Финансовый аналитик;Финансовый аналитик/Экономист;Новосибирск;Модульбанк;;p&l, ms power bi, ms excel;От 1 года до 3 лет;2023-04-24;;;
79353944;Финансовый аналитик;Финансовый аналитик (финансовый контролер);Новосибирск;Кварталы Немировича;;умение работать с большим объемом информации, excel, подготовка управленческой отчетности, 1с: предприятие 8;От 1 года до 3 лет;2023-04-26;;60000;RUR
79643815;Финансовый аналитик;Финансовый аналитик;Новосибирск;Совкомбанк;;подготовка презентаций, деловая коммуникация, деловая переписка, деловое общение, английский язык;От 1 года до 3 лет;2023-04-21;;;
79784169;Финансовый аналитик;Финансовый аналитик;Новосибирск;ГиД;;бухгалтерский учет, анализ данных, работа с большим объемом информации, финансовое планирование, аналитическое мышление, финансовый анализ, erp-системы на базе 1с, ms excel;От 1 года до 3 лет;2023-04-28;44000;;RUR
78110132;Финансовый аналитик;Финансовый аналитик;Новосибирск;LIME RUSSIA;;прогнозирование, английский язык, ms powerpoint, статистический анализ, бюджетирование;От 1 года до 3 лет;2023-04-26;55000;;RUR
