id;spec;job_title;city;employer;schedule;skills;experience;published;salary_from;salary_to;currency
78126633;Финансовый аналитик;Финансовый аналитик;Видное;Албес;;план-фактный анализ бюджета, 1с: документооборот, расчет и анализ себестоимости продукции и услуг, планирование карьеры, 1с: управление предприятием;От 1 года до 3 лет;2023-04-21;100000;;RUR
78711654;Финансовый аналитик;Финансовый аналитик;Дзержинский;Городской Транзит;;финансовый анализ, план-фактный анализ бюджета, анализ текущих финансовых показателей, управленческая отчетность, бюджетирование, 1с: бухгалтерия;От 3 до 6 лет;2023-03-30;115000;;RUR
79589537;Финансовый аналитик;Финансовый аналитик;Домодедово;АкваФреш;;анализ бизнес показателей, аналитика, движение денежных средств, анализ данных, анализ финансовых показателей, подготовка управленческой отчетности, внутренний финансовый аудит, энтузиазм;От 3 до 6 лет;2023-04-20;80000;130000;RUR
79051515;Финансовый аналитик;Финансовый аналитик по производству;Подольск (Московская область);Фармстандарт-Медтехника;;;От 1 года до 3 лет;2023-04-07;80000;;RUR
78878711;Финансовый аналитик;Финансовый аналитик;Люберцы;Торговый дом-ВИК;;;От 3 до 6 лет;2023-04-04;;;
78778489;Финансовый аналитик;Старший финансовый аналитик;Орехово-Зуево;ВЕРОФАРМ;;;От 3 до 6 лет;2023-03-31;;;
78126693;Финансовый аналитик;Финансовый аналитик;Домодедово;Албес;;план-фактный анализ бюджета, 1с: документооборот, расчет и анализ себестоимости продукции и услуг, планирование карьеры, 1с: управление предприятием;От 1 года до 3 лет;2023-04-21;100000;;RUR
79323231;Финансовый аналитик;Помощник главного бухгалтера / финансовый аналитик;Химки;ФИТВЕНД;;1с: бухгалтерия, 1с: документооборот, ms excel, аналитический склад ума, навыки составления отчетности, анализ данных, статистический анализ, математическая статистика, математический анализ, сводные таблицы, google таблицы, работа в условиях многозадачности, сосредоточенность;От 1 года до 3 лет;2023-04-14;50000;50000;RUR
79046637;Финансовый аналитик;Финансовый аналитик;Владивосток;Бизнес-Консалт;;;От 3 до 6 лет;2023-04-28;200000;300000;RUR
78059938;Финансовый аналитик;Старший финансовый аналитик;Владивосток;Проект;;финансовый анализ, анализ текущих финансовых показателей, экономический анализ, анализ инвестиционных проектов, ms powerpoint;От 1 года до 3 лет;2023-04-24;100000;;RUR
79582205;Финансовый аналитик;Финансовый аналитик в г. Владивосток;Владивосток;Русская Рыбопромышленная Компания;;бюджетирование, план-факторный анализ, расчет kpi, бизнес-планирование, базы данных, бдр, бддс, ms excel, power pivot, power query, power bi, 1 с, управленческий учет, cima;От 3 до 6 лет;2023-04-20;;;
75587959;Финансовый аналитик;Ведущий финансовый аналитик;Владивосток;DNS Головной офис;;анализ текущих финансовых показателей, работа с большим объемом информации, ms powerpoint, деловая коммуникация, многозадачность;От 3 до 6 лет;2023-04-27;90000;100000;RUR
78889069;Финансовый аналитик;Финансовый аналитик;Владивосток;РЕФГО;;анализ финансовых показателей, google sheets, работа в команде, google таблицы, впр, навыки работы с большим объемом информации, организация и планирование рабочего времени, аналитика, подготовка отчетов;От 1 года до 3 лет;2023-04-28;30000;65000;RUR
77109243;Финансовый аналитик;Финансовый аналитик;Владивосток;Бубль Гум, Розничная сеть;;excel, работа с большим объемом информации, экономика, экономический анализ, аналитическое мышление;От 1 года до 3 лет;2023-04-28;50000;60000;RUR
79856416;Финансовый аналитик;Аналитик финансового рынка;Владивосток;Центральный банк Российской Федерации;;ценные бумаги, поиск информации в интернет, мониторинг рынка, фондовый рынок, аналитические исследования, биржевые торги, валютные операции;От 1 года до 3 лет;2023-04-27;;;
79585305;Финансовый аналитик;Финансовый аналитик в г. Владивосток;Хабаровск;Русская Рыбопромышленная Компания;;бюджетирование, план-факторный анализ, расчет kpi, бизнес-планирование, базы данных, бдр, бддс, ms excel, power pivot, power query, power bi, 1 с, управленческий учет, cima;От 3 до 6 лет;2023-04-20;;;
79636389;Финансовый аналитик;Финансовый аналитик по работе с банками;Хабаровск;Эй-Пи Трейд;;;От 1 года до 3 лет;2023-04-21;45000;45000;RUR
78984500;Финансовый аналитик;Финансовый аналитик / финансовый менеджер;Калининград;Тойота Центр Калининград;;финансовый анализ, управленческая отчетность, бюджетирование, аналитическое мышление, формирование управленческой отчетности, финансовый контроль, анализ финансовых показателей, анализ данных, анализ бизнес показателей, системное мышление;От 1 года до 3 лет;2023-04-28;57500;;RUR
79919188;Финансовый аналитик;Финансовый аналитик;Великий Новгород;ИКЕА Индастри Новгород;;;От 1 года до 3 лет;2023-04-28;;;
79676332;Финансовый аналитик;Финансовый аналитик;Великий Новгород;ДС Контролз;;финансовый анализ, управленческий учет, финансовая отчетность, управленческая отчетность, бюджетирование;От 3 до 6 лет;2023-04-21;;;
79383810;Финансовый аналитик;Финансовый аналитик;Санкт-Петербург;Планета вкуса;;финансовая отчетность, формирование управленческой отчетности, анализ данных, аналитическое мышление, анализ финансовых показателей, ms excel, работа с большим объемом информации, ms powerpoint, опу/pl, офп/bs, оддс/cf;От 3 до 6 лет;2023-04-26;120000;130000;RUR
77470114;Финансовый аналитик;Финансовый аналитик;Санкт-Петербург;LEGENDA;;мсфо, бухгалтерская отчетность, внутренний контроль, финансовая отчетность, аналитика, финансовый анализ, финансовое моделирование, анализ фхд, оценка инвестиционных проектов, ms powerpoint;От 1 года до 3 лет;2023-04-28;115000;;RUR
79763352;Финансовый аналитик;Финансовый аналитик;Санкт-Петербург;ЕВА;;опытный пользователь пк, умение работать в режиме многозадачности, анализ продаж, планирование, многозадачность, анализ финансовых показателей, экономический анализ, адекватность, аналитическое мышление, аналитические навыки, грамотная речь, финансы, опрятность, работа с компьютером, работа в условиях многозадачности, финансовый анализ, знание компьютера;От 3 до 6 лет;2023-04-28;70000;;RUR
79293910;Финансовый аналитик;Финансовый аналитик;Санкт-Петербург;Терра Нова;;;От 3 до 6 лет;2023-04-26;;100000;RUR
79799356;Финансовый аналитик;Финансовый аналитик;Санкт-Петербург;Йоллло;;ms office, экономический анализ, бухгалтерский учет, анализ финансовых показателей, аналитический склад ума, excel;От 3 до 6 лет;2023-04-25;40000;;RUR
79931603;Финансовый аналитик;Финансовый менеджер-аналитик;Санкт-Петербург;НПФ Спецмаш;;;От 3 до 6 лет;2023-04-28;80000;;RUR
78288925;Финансовый аналитик;Финансовый аналитик;Санкт-Петербург;Юпитер;;финансовый анализ, анализ текущих финансовых показателей, внутренний финансовый аудит, аналитические исследования, инвестиционный анализ;От 1 года до 3 лет;2023-04-28;80000;;RUR
78955615;Финансовый аналитик;Финансовый аналитик;Санкт-Петербург;АДЪЮТОР;;экономический анализ, финансовый анализ, финансовое планирование, финансовый менеджмент, аналитическое мышление, бюджетирование;От 3 до 6 лет;2023-04-26;92000;;RUR
79768631;Финансовый аналитик;Финансовый менеджер-аналитик;Санкт-Петербург;Школа мастеров массажа;;финансовая отчетность, анализ текущих финансовых показателей, анализ финансовых показателей, финансовый анализ, аналитические исследования, финансовый контроль, экономический анализ;От 3 до 6 лет;2023-04-25;80000;100000;RUR
79735800;Финансовый аналитик;Финансовый аналитик;Санкт-Петербург;ДС Контролз;;финансовый анализ, управленческий учет, финансовая отчетность, управленческая отчетность, бюджетирование;От 3 до 6 лет;2023-04-27;;;
79819797;Финансовый аналитик;Младший финансовый аналитик;Санкт-Петербург;Теком;;финансовый контроль, финансовое планирование, 1с: предприятие 8, оптимизация бизнес-процессов;От 1 года до 3 лет;2023-04-26;40000;50000;RUR
79365941;Финансовый аналитик;Финансовый аналитик;Санкт-Петербург;Revocars;;;От 3 до 6 лет;2023-04-26;;;
78948681;Финансовый аналитик;Оценщик бизнеса/Финансовый аналитик;Санкт-Петербург;УК Магистр;;;От 3 до 6 лет;2023-04-26;100000;120000;RUR
77319139;Финансовый аналитик;Бизнес - аналитик/финансовый-аналитик;Санкт-Петербург;KASSIR.RU;;;От 1 года до 3 лет;2023-04-27;;;
74247441;Финансовый аналитик;Финансовый аналитик;Санкт-Петербург;Главстрой Санкт-Петербург;;факторный анализ, управление рисками, финансовые модели, excel;От 1 года до 3 лет;2023-04-26;;;
78581319;Финансовый аналитик;Финансовый аналитик;Санкт-Петербург;ABSOL;;;От 1 года до 3 лет;2023-04-22;90000;120000;RUR
78462518;Финансовый аналитик;Финансовый аналитик;Санкт-Петербург;Группа ЛСР;;экономический анализ, ms powerpoint, 1с: предприятие 8, финансовый анализ, анализ себестоимости, power bi;От 1 года до 3 лет;2023-04-24;;;
79762701;Финансовый аналитик;Финансовый аналитик;Санкт-Петербург;Важная рыба;;анализ текущих финансовых показателей, анализ финансовых показателей, внутренний финансовый аудит;От 3 до 6 лет;2023-04-28;;;
79676614;Финансовый аналитик;Финансовый аналитик;Санкт-Петербург;ГК Эксперт;;;От 3 до 6 лет;2023-04-21;;;
78990365;Финансовый аналитик;Финансовый аналитик;Санкт-Петербург;Тазмар;;;От 1 года до 3 лет;2023-04-27;;;
78259703;Финансовый аналитик;Аналитик в финансовый отдел;Санкт-Петербург;Аэропорт Пулково (ООО Воздушные Ворота Северной Столицы);;управленческая отчетность, sap;От 1 года до 3 лет;2023-04-21;;;
72778155;Финансовый аналитик;Финансовый контролер/аналитик;Санкт-Петербург;Синтез ОКА;;ms powerpoint, 1с: документооборот, erp-системы на базе 1с, организаторские навыки, участие в переговорах, процесс учета и бюджетирования, анализ инвестиционных проектов, управление финансами, дипифр, cima, acca;От 1 года до 3 лет;2023-04-26;;;
78983651;Финансовый аналитик;Финансовый аналитик;Санкт-Петербург;Институт Тренинга - АРБ Про, группа компаний;;финансовый анализ, финансовое планирование, управленческая отчетность, управление финансами, финансовая отчетность, финансовый контроль, анализ текущих финансовых показателей, внутренний финансовый аудит, план-фактный анализ бюджета;От 3 до 6 лет;2023-04-27;;;
78312035;Финансовый аналитик;Финансовый аналитик производства;Санкт-Петербург;BAT Russia;;;От 3 до 6 лет;2023-04-19;100000;;RUR
78949507;Финансовый аналитик;Ведущий экономист/финансовый аналитик/руководитель проекта;Санкт-Петербург;Институт проблем предпринимательства;;управленческий учет, финансовый анализ, бизнес-моделирование, финансовое моделирование, финансовое планирование, бюджетирование, бизнес-планирование, деловая коммуникация, прогнозирование, составление бизнес-плана;От 3 до 6 лет;2023-04-26;80000;90000;RUR
79662387;Финансовый аналитик;Финансовый Аналитик;Санкт-Петербург;Cfoclub (ИП Валуев Кирилл Владимирович);;экономическое моделирование, бюджетирование, финансовое планирование, бизнес-планирование, экономический анализ, ms powerpoint, подготовка презентаций, анализ инвестиционных проектов, управленческий учет, финансовый анализ;От 3 до 6 лет;2023-04-21;86000;115000;RUR
79479554;Финансовый аналитик;Главный специалист по бюджетированию (финансовый аналитик);Санкт-Петербург;Концерн Морское подводное оружие – Гидроприбор;;1с: предприятие 8, бюджетирование, делопроизводство, 1c: бухгалтерия, управленческая отчетность, бюджет доходов и расходов, движение денежных средств, бдр, бддс, доходы и расходы, бухгалтерский баланс, аналитический баланс, аналитический склад ума, аналитическое мышление, mc excel;От 1 года до 3 лет;2023-04-28;76000;76000;RUR
79584552;Финансовый аналитик;Финансовый аналитик отдела контроллинга;Санкт-Петербург;Улыбка радуги;;;От 1 года до 3 лет;2023-04-20;70000;80000;RUR
75765979;Финансовый аналитик;Финансовый аналитик;Санкт-Петербург;Деньги на дом;;1с: предприятие 8, excel, подготовка отчетов;От 1 года до 3 лет;2023-04-18;90000;;RUR
79197703;Финансовый аналитик;Финансовый аналитик по логистике;Санкт-Петербург;ANCOR;;;От 3 до 6 лет;2023-04-12;;;
77586065;Финансовый аналитик;Младший финансовый аналитик;Санкт-Петербург;Фотосклад.ру;;анализ текущих финансовых показателей, работа с большим объемом информации, знание excel;От 1 года до 3 лет;2023-04-20;;;
75826460;Финансовый аналитик;Финансовый аналитик;Санкт-Петербург;ВЕРТЕКС;;анализ текущих финансовых показателей, аналитическое мышление, ms powerpoint, аналитические исследования, анализ данных;От 3 до 6 лет;2023-04-28;;;
78414281;Финансовый аналитик;Бизнес-аналитик в финансовый департамент;Санкт-Петербург;Мэлон Фэшн Груп;;прогнозирование, бюджетирование, планирование, финансовый анализ, планирование продаж;От 3 до 6 лет;2023-04-24;;;
78053887;Финансовый аналитик;Финансовый аналитик - бухгалтер;Санкт-Петербург;Марчеллис;;план-фактный анализ бюджета, работа с большим объемом информации, анализ данных, формирование бюджета, продвинутый пользователь ms excel, экономика, управленческая отчетность, сводные таблицы, финансовый анализ;От 3 до 6 лет;2023-04-25;;;
79742258;Финансовый аналитик;Финансовый аналитик / Аналитик по ценообразованию и товарному ассортименту;Санкт-Петербург;Гейзер, группа компаний;;анализ бизнес показателей, анализ финансовых показателей, работа с большим объемом информации, аналитическое мышление, анализ данных, power query, power pivot, регулирование розничных цен, работа в условиях многозадачности, контроль и анализ ценообразования;От 1 года до 3 лет;2023-04-27;70000;;RUR
78073594;Финансовый аналитик;Финансовый аналитик;Санкт-Петербург;Этажи Северо-Запад;;анализ текущих финансовых показателей, анализ финансовых показателей, корпоративная этика, аналитика, ориентация на результат, аналитическое мышление, работа в команде, грамотная речь, ms excel;От 1 года до 3 лет;2023-04-17;80000;;RUR
79335895;Финансовый аналитик;Финансовый аналитик;Санкт-Петербург;Газпром нефть;;sap, рсбу, формирование управленческой отчетности, финансовая отчетность, power point, анализ данных, анализ финансовых показателей, аналитическое мышление, анализ текущих финансовых показателей;От 1 года до 3 лет;2023-04-16;;;
79205535;Финансовый аналитик;Финансовый аналитик/Аналитик отдела продаж (отдел маркетплейсов);Санкт-Петербург;Prosafe;;умение работать с большим объемом информации, умение работать в режиме многозадачности, сосредоточенность, 1с: предприятие 8, работа с большим объемом информации, 1с: документооборот, ms access, деловая переписка, 1c: предприятие, excel, сводные таблицы;От 1 года до 3 лет;2023-04-28;;;
69948844;Финансовый аналитик;Финансовый аналитик;Санкт-Петербург;LCG Recruiting;;анализ текущих финансовых показателей, ms powerpoint, экономический анализ, аналитическое мышление, анализ финансовых показателей, ms excel;От 1 года до 3 лет;2023-04-18;75000;;RUR
78022753;Финансовый аналитик;Финансовый аналитик/Финансовый менеджер;Санкт-Петербург;АВТОПОЛЕ;;аналитическое мышление, ms powerpoint, анализ данных, работа с большим объемом информации, финансовое моделирование, финансовый анализ, анализ бизнес показателей, power bi, финансовый менеджмент, финансовый контроль, ms excel, 1с: предприятие 8, управленческая отчетность, финансовая отчетность, визуализация, конкурентная аналитика, краткосрочное бюджетирование и планирование, среднесрочное бюджетирование и планирование, план-фактный анализ бюджета;От 3 до 6 лет;2023-04-10;120000;;RUR
