id;spec;job_title;city;employer;schedule;skills;experience;published;salary_from;salary_to;currency
79910190;Финансовый аналитик;Финансовый аналитик;Москва;Агрокультура Групп;;работа с большим объемом информации, анализ данных, excel, продвинутый пользователь excel, аналитическое мышление, отчетность;От 3 до 6 лет;2023-04-28;;;
79932192;Финансовый аналитик;Финансовый аналитик;Москва;ПК Красота и Здоровье;;;От 3 до 6 лет;2023-04-28;100000;120000;RUR
79268193;Финансовый аналитик;Финансовый аналитик;Москва;Академия Максимус;;;От 1 года до 3 лет;2023-04-28;100000;;RUR
78513451;Финансовый аналитик;Аналитик (финансовая отчетность);Москва;Стройтрансгаз, ГК;;;Нет опыта;2023-04-28;;;
78542572;Финансовый аналитик;Финансовый аналитик;Москва;ВсеИнструменты.ру;;маржинальный анализ, аналитика продаж, финансовый анализ, аналитическое мышление, аналитические способности, анализ текущих финансовых показателей, ассортиментная матрица;От 1 года до 3 лет;2023-04-25;;;
77469463;Финансовый аналитик;Финансовый аналитик;Москва;DEPO Computers;;;От 3 до 6 лет;2023-04-24;100000;;RUR
79515966;Финансовый аналитик;Финансовый аналитик/Экономист;Москва;Знак;;финансовая отчетность, экономический анализ, ms excel, движение денежных средств, формирование управленческой отчетности;От 1 года до 3 лет;2023-04-28;;;
79120312;Финансовый аналитик;Экономист/Финансовый аналитик;Москва;Современные Рельсовые Системы;;управленческая отчетность, 1с: предприятие 8, финансовый анализ, управленческий учет, бюджетирование;Более 6 лет;2023-04-28;110000;;RUR
79908003;Финансовый аналитик;Младший финансовый аналитик ВТБ РОСТ;Москва;FutureToday;;английский язык, корпоративные финансы, финансовый анализ, финансовое моделирование;От 1 года до 3 лет;2023-04-28;;;
79437115;Финансовый аналитик;Финансовый аналитик (по производству);Москва;СИ Групп/ИнфоЛинк;;аналитическое мышление, 1с: управление производственным предприятием, erp, erp ух, управленческая отчетность, коммуникабельность, ответственность, работа с большим объемом информации, ms excel;Более 6 лет;2023-04-27;120000;;RUR
79153674;Финансовый аналитик;Младший финансовый аналитик;Москва;ЛАНИТ;;;От 1 года до 3 лет;2023-04-26;;;
79444944;Финансовый аналитик;Финансовый аналитик (проектное и инвестиционное финансирование);Москва;Фонд развития промышленности;;финансовый анализ, управление проектами, финансовое моделирование, инвестиционный анализ, аналитические способности;От 1 года до 3 лет;2023-04-27;;;
78959762;Финансовый аналитик;Старший финансовый аналитик;Москва;Ozon;;анализ текущих финансовых показателей, контроль и анализ ценообразования, фитнес, многозадачность, аналитическое мышление;От 3 до 6 лет;2023-04-28;;;
78899105;Финансовый аналитик;Финансовый аналитик (г. Химки);Москва;Комбинат;;финансовый анализ, контроль и анализ ценообразования, анализ текущих финансовых показателей, финансовая отчетность, финансовое планирование;От 3 до 6 лет;2023-04-28;120000;120000;RUR
79675628;Финансовый аналитик;Финансовый аналитик;Москва;ГОЛДЕНГУС ИНТЕРНЕШНЛ;;;От 1 года до 3 лет;2023-04-21;;200000;RUR
79260195;Финансовый аналитик;Финансовый аналитик;Москва;Softline;;английский язык, ms powerpoint, проведение тренинга для новых сотрудников, международные стандарты бухгалтерского учета, рсбу, мсфо, оценка бизнеса, инвестиционная деятельность;От 3 до 6 лет;2023-04-28;;;
78261393;Финансовый аналитик;Финансовый аналитик (запасные части);Москва;Чери Автомобили Рус;;экономический анализ, английский язык, финансовый анализ, статистический анализ, работа с большим объемом информации;От 3 до 6 лет;2023-04-28;;190000;RUR
79813642;Финансовый аналитик;Финансовый аналитик;Москва;Изолятор-высоковольтные вводы;;аналитическое мышление, уверенный пользователь ms office, анализ финансовых показателей, прогнозирование, английский язык (upper-intermediate), анализ текущих финансовых показателей;От 3 до 6 лет;2023-04-26;;;
79091357;Финансовый аналитик;Финансовый Аналитик торгового маркетинга и денежных средств;Москва;Kraft Heinz;;sap erp, финансовая отчетность, английский язык pre-intermediate, подготовка презентаций, ms excel, ведение отчетности;От 1 года до 3 лет;2023-04-27;;;
79703316;Финансовый аналитик;Старший финансовый аналитик;Москва;Glosema Group;;bloomberg, корпоративные финансы, анализ текущих финансовых показателей, внутренний финансовый аудит, финансовое моделирование, бизнес-консультирование;От 1 года до 3 лет;2023-04-24;100000;100000;RUR
79143095;Финансовый аналитик;Финансовый аналитик (автобизнес);Москва;Кунцево, Технический центр;;продвинутый пользователь excel, подготовка презентаций, работа в условиях многозадачности, работа с большим объемом информации, формирование управленческой отчетности;От 1 года до 3 лет;2023-04-27;103000;115000;RUR
79538307;Финансовый аналитик;Ведущий финансовый аналитик;Москва;Тайсу;;бюджетирование, финансовый контроль, финансовый анализ, управленческая отчетность, управленческий учет, финансовая отчетность, управление финансами, формирование бюджета;От 3 до 6 лет;2023-04-28;110000;;RUR
79876133;Финансовый аналитик;Ведущий финансовый аналитик;Москва;Ventra;;;От 3 до 6 лет;2023-04-27;;;
77014554;Финансовый аналитик;Стажер в Отдел финансового анализа;Москва;РН Банк;;финансовый анализ, ms excel, бухгалтерский учет, анализ финансовых показателей;Нет опыта;2023-04-28;;;
77618727;Финансовый аналитик;Финансовый менеджер-аналитик;Москва;OnePrice Coffee;;управленческая отчетность, бюджетирование, финансовый контроль, финансовый анализ, краткосрочное бюджетирование и планирование;От 1 года до 3 лет;2023-04-27;100000;;RUR
79525917;Финансовый аналитик;Финансовый аналитик;Москва;Неофлекс;;sql запросы, ms sql, sql, big data, hadoop, hive, финансовый анализ, статьи доходов;От 1 года до 3 лет;2023-04-25;;;
79387351;Финансовый аналитик;Финансовый менеджер с функциями аналитика;Москва;ТК Магнум Ойл;;финансовый анализ, финансовая отчетность, 1c: бухгалтерия, управленческая отчетность, 1с: торговля и склад;От 3 до 6 лет;2023-04-26;90000;120000;RUR
79928358;Финансовый аналитик;Финансовый аналитик;Москва;MAYRVEDA Kislovodsk 5* MediSpa- отель;;финансовый анализ, анализ текущих финансовых показателей, оценка инвестиционных проектов, финансовое моделирование, анализ инвестиционных проектов;От 3 до 6 лет;2023-04-28;90000;150000;RUR
79672354;Финансовый аналитик;Помощник финансового аналитика;Москва;Альфа-Логистик;;аналитическое мышление, работа с базами данных, анализ данных, аналитика, ms excel, работа с большим объемом информации, анализ рынка, анализ конкурентной среды, анализ ценообразования, работа с компьютером, многозадачность, умение работать в команде, анализ продаж;От 1 года до 3 лет;2023-04-27;;80000;RUR
79673474;Финансовый аналитик;Старший финансовый аналитик;Москва;Мерседес-Бенц РУС;;ms excel, финансовый анализ, аналитика продаж;От 3 до 6 лет;2023-04-21;;;
79822325;Финансовый аналитик;Главный финансовый аналитик;Москва;Фитнес-клубы XFIT;;аналитические способности, управленческий учет, прогнозирование, финансовое моделирование, финансовый анализ, анализ фхд, рсбу, моделирование, основы бухгалтерского учета, продвинутый пользователь ms excel;От 3 до 6 лет;2023-04-26;;130000;RUR
79443886;Финансовый аналитик;Финансовый аналитик / Экономист;Москва;Хирана+;;финансовый анализ, кредиторская задолженность, план-фактный анализ бюджета, анализ текущих финансовых показателей, внутренний финансовый аудит, финансовый контроль, ms outlook, первичные документы, финансовая отчетность, анализ фхд, финансовое планирование, планирование, краткосрочное бюджетирование и планирование, подготовка отчетов, анализ данных, формирование управленческой отчетности, долгосрочное бюджетирование и планирование, 1c: финансы, работа в условиях многозадачности, контроль и анализ ценообразования;От 3 до 6 лет;2023-04-27;80000;120000;RUR
78604641;Финансовый аналитик;Финансовый аналитик;Москва;СберМаркет;;финансовая отчетность, excel, анализ бизнес показателей, управленческая отчетность, анализ текущих финансовых показателей, financial accounting;От 3 до 6 лет;2023-04-27;;;
78638411;Финансовый аналитик;Финансовый аналитик (Медицина);Москва;Мединвестгрупп;;;От 3 до 6 лет;2023-04-20;;240000;RUR
77766688;Финансовый аналитик;Экономист / аналитик / финансовый менеджер;Москва;АРНИ;;;От 3 до 6 лет;2023-04-25;120000;120000;RUR
79693771;Финансовый аналитик;Финансовый аналитик;Москва;ANCOR;;;От 3 до 6 лет;2023-04-23;;;
79294788;Финансовый аналитик;Финансовый аналитик;Москва;Волконский, кондитерская;;;От 1 года до 3 лет;2023-04-20;120000;130000;RUR
79385547;Финансовый аналитик;Финансовый менеджер-аналитик;Москва;Алвори Групп;;работа с большим объемом информации, финансовый анализ, анализ текущих финансовых показателей, внешний финансовый аудит, внутренний финансовый аудит, контроль и анализ ценообразования;От 1 года до 3 лет;2023-04-26;65000;;RUR
79587021;Финансовый аналитик;Бухгалтер/финансовый аналитик;Москва;Андрихов Лев Валерьевич;;бухгалтерский учет, финансовый контроль, финансовая отчетность, ориентация на результат, аналитическое мышление, анализ финансовых показателей, бухгалтерская отчетность, налоговая отчетность;От 1 года до 3 лет;2023-04-26;65000;150000;RUR
77963417;Финансовый аналитик;Финансовый аналитик;Москва;MAXIMUM EDUCATION;;финансовый анализ, финансовая отчетность, аналитическое мышление;От 1 года до 3 лет;2023-04-27;;;
79439569;Финансовый аналитик;Финансовый аналитик (экономист по труду);Москва;Мостоотряд-47;;оформление документации, directum, ms outlook, ms powerpoint, ms internet explorer;От 1 года до 3 лет;2023-04-27;120000;120000;RUR
77441442;Финансовый аналитик;Финансовый аналитик;Москва;Бренд женской одежды и аксессуаров LIME;;;От 3 до 6 лет;2023-04-25;;;
78590185;Финансовый аналитик;Финансовый аналитик;Москва;CARDIF, Страховая компания;;sql, управленческая отчетность, управление инвестициями, финансовое моделирование;От 1 года до 3 лет;2023-04-24;;;
79617332;Финансовый аналитик;Финансовый аналитик;Москва;ВСК, САО;;;От 1 года до 3 лет;2023-04-20;120000;130000;RUR
78444217;Финансовый аналитик;Финансовый аналитик;Москва;Группа ВИС;;финансовое моделирование, консолидация отчетности по рсбу, мсфо, ms excel, инвестиционный анализ, финансовый анализ;От 3 до 6 лет;2023-04-20;180000;;RUR
79577444;Финансовый аналитик;Финансовый аналитик (FP&L);Москва;ANCOR;;;От 3 до 6 лет;2023-04-20;;200000;RUR
78337707;Финансовый аналитик;Финансовый аналитик;Москва;Коттон Вэй;;;От 1 года до 3 лет;2023-04-28;;;
79148056;Финансовый аналитик;Финансовый аналитик;Москва;НБК Финанс;;внешний финансовый аудит, внутренний финансовый аудит, анализ доходов, анализ расходов, управленческая отчетность, финансовая отчетность, рентабельность бизнеса, legal collection, 1с: предприятие - бухгалтерия, 1с: управление предприятием, подготовка управленческой отчетности, составление отчетности;От 1 года до 3 лет;2023-04-24;50000;;RUR
78761598;Финансовый аналитик;Финансовый аналитик (Группа управленческого учета и аудита);Москва;RRC;;;От 3 до 6 лет;2023-04-27;;;
79530977;Финансовый аналитик;Финансовый аналитик;Москва;Авторитэйл М;;pl, cf и bs;От 1 года до 3 лет;2023-04-19;180000;200000;RUR
79148771;Финансовый аналитик;Финансовый аналитик;Москва;Green Flow;;;От 1 года до 3 лет;2023-04-20;;150000;RUR
78928903;Финансовый аналитик;Финансовый аналитик / экономист;Москва;Ресурс Менеджмент;;ms excel, аналитические способности, тайм-менеджмент, ответственность и исполнительность, экономика, финансовый анализ, финансовый контроль;От 1 года до 3 лет;2023-04-26;100000;100000;RUR
78692497;Финансовый аналитик;Старший финансовый аналитик;Москва;ГЕТ ЭКСПЕРТС РЕКРУТМЕНТ;;;От 3 до 6 лет;2023-04-25;;;
79460654;Финансовый аналитик;Финансовый аналитик;Москва;Мэри Трюфель;;;От 1 года до 3 лет;2023-04-27;80000;;RUR
78730573;Финансовый аналитик;Финансовый аналитик;Москва;BI.ZONE;;ms excel, аналитика, финансовое моделирование, расчет и анализ себестоимости продукции и услуг;От 1 года до 3 лет;2023-04-25;;;
78905576;Финансовый аналитик;Финансовый аналитик;Москва;БСВР Групп;;финансовый анализ, экономический анализ, пакет ms office;От 3 до 6 лет;2023-04-28;;;
77965119;Финансовый аналитик;Финансовый аналитик;Москва;Старый Мастер;;;От 1 года до 3 лет;2023-04-26;;;
79096341;Финансовый аналитик;Финансовый менеджер-аналитик;Москва;РусСибКонтроль;;финансовый анализ, анализ текущих финансовых показателей, план-фактный анализ бюджета, финансовое планирование, бюджетирование;От 3 до 6 лет;2023-04-28;;;
79580333;Финансовый аналитик;Финансист / Финансовый аналитик (удаленно);Москва;Силина Татьяна Андреевна;;аналитическое мышление, анализ данных, анализ бизнес показателей, бизнес-анализ, google sheets;От 1 года до 3 лет;2023-04-20;50000;80000;RUR
72727153;Финансовый аналитик;Финансовый аналитик CIB;Москва;Московский Кредитный Банк;;ms powerpoint, финансовый анализ, финансовая отчетность, английский язык, управленческая отчетность;От 3 до 6 лет;2023-04-26;;;
79614994;Финансовый аналитик;Финансовый аналитик;Москва;ЦУМ, ТД;;;От 1 года до 3 лет;2023-04-20;;;
78714825;Финансовый аналитик;Финансовый аналитик и контролер;Москва;Иннотек Интернасиональ;;;Более 6 лет;2023-04-26;;;
79831634;Финансовый аналитик;Менеджер по бизнес-аналитике и финансовому анализу;Москва;Чижик;;sap erp, cognos bi, power query, vba, power bi, sap bi, ms powerpoint, бизнес-анализ, анализ бизнес показателей, визуализация данных, cognos, деловая коммуникация;От 3 до 6 лет;2023-04-26;;;
78927135;Финансовый аналитик;Финансовый аналитик;Москва;Такси Шоколад;;бюджетирование, финансовый анализ, управленческая отчетность, управленческий учет, дебиторская задолженность;Нет опыта;2023-04-26;50000;70000;RUR
79582126;Финансовый аналитик;Финансовый аналитик (Оптимакрос / Anaplan);Москва;Тинькофф;;jira, моделирование, anaplan, оптимакрос;От 1 года до 3 лет;2023-04-24;;;
78786744;Финансовый аналитик;Финансовый аналитик;Москва;Фитмост;;анализ текущих финансовых показателей, ms powerpoint, анализ финансовых показателей, аналитическое мышление, умение адаптироваться, google таблицы, ms power bi, google sheets, финансовый анализ, внутренний финансовый аудит, контроль и анализ ценообразования;От 3 до 6 лет;2023-04-27;;;
79612025;Финансовый аналитик;Финансовый аналитик по cash flow;Москва;Яндекс;;;Нет опыта;2023-04-20;;;
79654214;Финансовый аналитик;Старший финансовый аналитик;Москва;Ozon;;sql, управленческая отчетность, ms excel;От 1 года до 3 лет;2023-04-21;;;
79604573;Финансовый аналитик;Финансовый аналитик в финтех-сервисы;Москва;Яндекс;;npv, ltv, sql, финансовый анализ;От 3 до 6 лет;2023-04-20;;;
79504645;Финансовый аналитик;Начинающий финансовый аналитик/бизнес-ассистент;Москва;GORA GROUP LLC;;деловая переписка, деловое общение, подготовка презентаций, финансовый анализ, бухгалтерский учет, аналитическое мышление, аналитика, грамотная устная и письменная речь;От 1 года до 3 лет;2023-04-19;;;
78957868;Финансовый аналитик;Финансовый аналитик (расходы);Москва;Банк Хоум Кредит;;capex, opex, cima, финансовая отчетность, моделирование;От 3 до 6 лет;2023-04-25;;;
78088347;Финансовый аналитик;Финансовый аналитик;Москва;Orion Group;;ms powerpoint, бюджетирование, аналитическое мышление, ms access, прогнозирование, анализ финансовых показателей, экономический анализ, финансовая отчетность, план-фактный анализ бюджета, финансовый анализ, анализ текущих финансовых показателей;От 1 года до 3 лет;2023-04-26;80000;;RUR
79613492;Финансовый аналитик;Финансовый аналитик;Москва;Гибрид;;;От 1 года до 3 лет;2023-04-20;;;
79653199;Финансовый аналитик;Финансовый аналитик / эксперт по финансовому моделированию;Москва;ДПО Пластик;;;От 1 года до 3 лет;2023-04-27;;;
79548357;Финансовый аналитик;Финансовый аналитик;Москва;ТрансЛом;;;От 3 до 6 лет;2023-04-19;145000;;RUR
