id;spec;job_title;city;employer;schedule;skills;experience;published;salary_from;salary_to;currency
76448725;Финансовый аналитик;Финансовый аналитик;Москва;Ростелеком - Центры обработки данных;;;От 3 до 6 лет;2023-04-17;;;
79251707;Финансовый аналитик;Финансовый аналитик;Москва;Космос Лидс;;p&l, excel, анализ финансовых показателей;От 1 года до 3 лет;2023-04-28;100000;;RUR
78732123;Финансовый аналитик;Финансовый аналитик;Москва;Агат-РТ;;;От 1 года до 3 лет;2023-04-26;100000;;RUR
79404553;Финансовый аналитик;Финансовый аналитик в команду подписной выручки, привлечения и девайсов.;Москва;Яндекс;;;От 3 до 6 лет;2023-04-17;;;
79447007;Финансовый аналитик;Старший финансовый аналитик;Москва;АЙТИ.СПЕЙС;;1c, эдо, sap, fmcg, excel;От 3 до 6 лет;2023-04-18;;151000;RUR
76600340;Финансовый аналитик;Финансовый аналитик в Банк;Москва;РЕСО-Гарантия, САО;;финансовый анализ, анализ текущих финансовых показателей, 1c: бухгалтерия, бухгалтерский учет, аналитическое мышление;От 1 года до 3 лет;2023-04-17;;;
78239959;Финансовый аналитик;Финансовый аналитик (консалтинг);Москва;Компания Пачоли;;ms excel, анализ рынка, анализ финансовых показателей, финансовый анализ, грамотная речь, подготовка презентаций;От 1 года до 3 лет;2023-04-17;;;
78931453;Финансовый аналитик;Финансовый аналитик (складская недвижимость);Москва;NF Group;;;От 3 до 6 лет;2023-04-24;;;
78324147;Финансовый аналитик;Финансовый аналитик;Москва;Комос Групп;;;От 3 до 6 лет;2023-04-20;;;
66635670;Финансовый аналитик;Финансовый аналитик;Москва;АВТОМИР, ГК;;ms access, базы данных, power bi, vba, математическая статистика, анализ финансовых показателей, системное мышление, математическое моделирование, прогнозирование, sql, ms powerpoint, бизнес-планирование, аналитическое мышление, анализ данных, бизнес-анализ, контроль и анализ ценообразования, ms sql, экономический анализ, отчетность;От 1 года до 3 лет;2023-04-17;;;
79054174;Финансовый аналитик;Ведущий специалист по бюджетированию и финансовому анализу;Москва;Гален;;ms excel, 1с: предприятие 8, powerbi, финансовый анализ, краткосрочное бюджетирование и планирование, долгосрочное бюджетирование и планирование, power query, управленческая отчетность, аналитическое мышление, факторный анализ;От 3 до 6 лет;2023-04-28;;;
78295664;Финансовый аналитик;Финансовый аналитик;Москва;CarMoney;;;От 3 до 6 лет;2023-04-14;;;
79138321;Финансовый аналитик;Младший финансовый аналитик;Москва;Газпромбанк Автолизинг;;многозадачность, excel, аналитические навыки, внимательность к деталям, способность работать с большими массивами информации;От 1 года до 3 лет;2023-04-11;;;
79193334;Финансовый аналитик;Финансовый аналитик;Москва;Банк ВТБ (ПАО);;;От 3 до 6 лет;2023-04-12;;;
79603213;Финансовый аналитик;Финансовый аналитик Центра сопровождения финансовых продуктов;Москва;ПСБ (Промсвязьбанк);;финансовый анализ, ms powerpoint, проведение презентаций, подготовка презентаций, анализ финансовых показателей;От 3 до 6 лет;2023-04-20;;;
79204978;Финансовый аналитик;Финансовый аналитик;Москва;X10 Strategy;;финансовая отчетность, финансовый контроль, финансовое планирование, финансовый менеджмент, анализ текущих финансовых показателей, финансовый анализ, внутренний финансовый аудит, внешний финансовый аудит, ms excel, 1c: финансы, 1c: бухгалтерия;От 3 до 6 лет;2023-04-12;60000;;RUR
74136916;Финансовый аналитик;Финансовый аналитик;Москва;Российские железные дороги;;финансовый анализ, финансовое моделирование, финансовая отчетность, оценка инвестиционных проектов, долговая нагрузка, формирование бюджета, оценка финансового состояния, acca, cima, мсфо, cfa, анализ финансовых показателей;От 3 до 6 лет;2023-04-18;;;
79529204;Финансовый аналитик;Финансовый аналитик;Москва;ПСБ Инновации и Инвестиции;;анализ бизнес показателей, аналитическое мышление, ориентация на результат, управленческая отчетность, финансовое моделирование, анализ текущих финансовых показателей, план-фактный анализ бюджета;От 3 до 6 лет;2023-04-19;;;
77936530;Финансовый аналитик;Старший финансовый аналитик (Планирование выручки);Москва;BAT Russia;;ms excel, ifrs, стратегическое мышление;От 3 до 6 лет;2023-04-12;162000;;RUR
75910717;Финансовый аналитик;Финансовый аналитик (в Омск);Москва;Ассоциация Хоккейный Клуб Авангард;;управленческая отчетность, бюджетирование, финансовое моделирование, анализ данных, ms excel, ms power point;От 3 до 6 лет;2023-04-20;;;
78759786;Финансовый аналитик;Финансовый аналитик-контролер;Москва;Finstar Financial Group;;финансовый анализ, английский язык, финансовая отчетность, экономический анализ, управленческая отчетность, ms sql, мсфо, ms excel, аналитика, анализ текущих финансовых показателей, работа с базами данных;От 3 до 6 лет;2023-04-06;180000;200000;RUR
79225329;Финансовый аналитик;Младший финансовый аналитик;Москва;O1 Standard;;финансовый анализ, бюджетирование, управленческий учет, ms outlook, бддс, бдр, коммерческая недвижимость, жилая недвижимость, управленческая отчетность, 1c: бухгалтерия, работа с большим объемом информации;От 3 до 6 лет;2023-04-14;;;
79055379;Финансовый аналитик;Финансовый аналитик;Москва;Гален;;ms excel, 1с: предприятие 8, powerbi, финансовый анализ, power query, управленческая отчетность, аналитическое мышление, факторный анализ;От 3 до 6 лет;2023-04-28;;;
79456497;Финансовый аналитик;Финансовый аналитик;Москва;FUN&SUN;;ms excel, anaplan, управленческий учет, финансовый анализ, организаторские способности, pl units;От 3 до 6 лет;2023-04-18;;;
79453115;Финансовый аналитик;Финансовый аналитик;Москва;ГЕТ ЭКСПЕРТС РЕКРУТМЕНТ;;;От 3 до 6 лет;2023-04-18;;;
78123406;Финансовый аналитик;Финансовый аналитик;Москва;АВТОДОМ;;;От 1 года до 3 лет;2023-04-07;240000;;RUR
79090857;Финансовый аналитик;Финансовый аналитик;Москва;Яндекс;;;От 3 до 6 лет;2023-04-10;;;
79367308;Финансовый аналитик;Финансовый аналитик (в сфере авиации);Москва;Почта России;;математическая статистика, финансовое моделирование, анализ инвестиционных проектов, бизнес-моделирование, авиаперевозки, финансовый анализ;От 3 до 6 лет;2023-04-17;;;
79324038;Финансовый аналитик;Финансовый аналитик (методолог);Москва;Кадровый холдинг ПРОФИЛЬ;;;От 3 до 6 лет;2023-04-14;;200000;RUR
69388869;Финансовый аналитик;Финансовый аналитик (корпоративные финансы);Москва;Российские железные дороги;;финансовый анализ, финансовое моделирование, финансовая отчетность, оценка инвестиционных проектов, долговая нагрузка, формирование бюджета, оценка финансового состояния, acca, cima, мсфо, cfa, анализ финансовых показателей;От 3 до 6 лет;2023-04-18;;;
79481135;Финансовый аналитик;Финансовый аналитик;Москва;Media Instinct Group;;;От 1 года до 3 лет;2023-04-21;;80000;RUR
79479210;Финансовый аналитик;Старший финансовый аналитик \ Senior Financial Analyst;Москва;Nestle;;;От 3 до 6 лет;2023-04-18;;;
79388122;Финансовый аналитик;Аналитик (финансовый анализ инвестиционного бизнеса);Москва;Банк Синара;;sql, системное мышление, аналитическое мышление, анализ финансовых показателей, стратегическое мышление, финансовый анализ, инвестиционный анализ;От 1 года до 3 лет;2023-04-17;;;
79671232;Финансовый аналитик;Финансовый аналитик;Москва;Салым Петролеум Девелопмент;;;От 3 до 6 лет;2023-04-21;;;
77972473;Финансовый аналитик;Финансовый аналитик (ценообразование);Москва;АЙТИ.СПЕЙС;;ценообразование, анализ финансовых показателей, аналитика, английский язык, аналитическое мышление, управление временем, анализ ценообразования, excel, 1c: финансы, sap, 1с;От 3 до 6 лет;2023-04-12;135000;150000;RUR
79123994;Финансовый аналитик;Финансовый аналитик;Москва;LIFE PAY;;;От 3 до 6 лет;2023-04-10;;;
79058231;Финансовый аналитик;Финансовый аналитик;Москва;ProStore;;финансовый анализ, ms powerpoint, управленческая отчетность, бизнес-планирование, бизнес-моделирование, 1c: бухгалтерия, 1c: финансы, ms excel, ms office, wms, capex, p&l, cash flow, business intelligence systems, power query, power pivot;От 1 года до 3 лет;2023-04-07;120000;;RUR
77336785;Финансовый аналитик;Старший финансовый аналитик;Москва;Alta Personnel;;;От 1 года до 3 лет;2023-04-17;;;
78457813;Финансовый аналитик;Финансовый аналитик IT проектов;Москва;Ростелеком;;;От 3 до 6 лет;2023-04-19;;;
79266376;Финансовый аналитик;Финансовый менеджер-аналитик;Москва;Мифтахов Олег Вилевич;;;От 1 года до 3 лет;2023-04-13;;;
79470669;Финансовый аналитик;Финансовый аналитик;Москва;ЕвроХим, Минерально-Химическая Компания;;контроль бюджета, sap ps, sap bi, продвинутый пользователь ms excel;От 3 до 6 лет;2023-04-18;;;
75762405;Финансовый аналитик;Финансовый аналитик;Москва;СБЕР;;финансовый анализ, план-фактный анализ бюджета, анализ текущих финансовых показателей, контроль и анализ ценообразования, ms excel;От 3 до 6 лет;2023-04-05;;;
79116941;Финансовый аналитик;Финансовый аналитик;Москва;Гринтех;;;От 3 до 6 лет;2023-04-10;160000;160000;RUR
74102818;Финансовый аналитик;Ведущий финансовый аналитик коммерческого транспорта;Москва;Черкизово, Группа предприятий;;английский язык, факторный анализ, аналитическое мышление, анализ данных, анализ финансовых показателей, прогнозирование, управление бюджетом, финансовое моделирование, коммуникативные навыки;От 3 до 6 лет;2023-04-20;;;
78150895;Финансовый аналитик;Старший финансовый аналитик;Москва;Циан;;;От 3 до 6 лет;2023-04-04;;;
79304412;Финансовый аналитик;Инвестиционный/финансовый аналитик;Москва;Тануки, японский ресторан;;;От 3 до 6 лет;2023-04-14;;;
79087609;Финансовый аналитик;Финансовый аналитик в продуктовую команду;Москва;Ростелеком;;;От 3 до 6 лет;2023-04-10;;;
79077926;Финансовый аналитик;Старший финансовый аналитик;Москва;BAT Russia;;;От 1 года до 3 лет;2023-04-10;112000;;RUR
78898558;Финансовый аналитик;Финансовый аналитик;Москва;Автомаркет;;анализ текущих финансовых показателей, контроль и анализ ценообразования, аналитическое мышление, экономический анализ, экономическое моделирование;От 1 года до 3 лет;2023-04-04;200000;;RUR
79001642;Финансовый аналитик;Старший финансовый аналитик;Москва;Иннотех, Группа компаний;;;От 3 до 6 лет;2023-04-06;;;
78587627;Финансовый аналитик;Финансовый аналитик;Москва;Медиа Бизнес Солюшенс;;финансовый анализ, план-фактный анализ бюджета, анализ текущих финансовых показателей, ms powerpoint, работа с большим объемом информации;От 3 до 6 лет;2023-04-19;;;
78052184;Финансовый аналитик;Финансовый аналитик;Москва;Московский Кредитный Банк;;английский язык, работа с базами данных, ведение отчетности, аналитическое мышление, ms access;От 1 года до 3 лет;2023-04-12;;;
79300397;Финансовый аналитик;Финансовый аналитик по Cash Flow FP&A;Москва;Ventra;;cash flow, p&l, план-фактный анализ бюджета, формирование управленческой отчетности, знание английского языка, анализ затрат, бюджетирование, us gaap, ifrs, управленческий учет, методология;От 3 до 6 лет;2023-04-14;;;
78817221;Финансовый аналитик;Финансовый аналитик (Цифровые поверхности Салют);Москва;СБЕР;;ms excel, анализ финансовых показателей;От 3 до 6 лет;2023-04-03;;;
78616444;Финансовый аналитик;Финансовый аналитик;Москва;MANGO OFFICE;;excel, рсбу, план-фактный анализ бюджета, внешний финансовый аудит, умение работать в условиях многозадачности, умение адаптироваться, умение слушать, аналитические навыки, уверенный пользователь ms office, анализ данных, аналитическое мышление, ms power bi, мсфо, 1с: бухгалтерия, деловая коммуникация, грамотная речь, работа с большим объемом информации;От 3 до 6 лет;2023-04-18;;;
79444327;Финансовый аналитик;Финансовый менеджер-аналитик;Москва;Коттеджный поселок Британика;;бюджетирование, управленческая отчетность, финансовый контроль, финансовый анализ, краткосрочное бюджетирование и планирование;От 3 до 6 лет;2023-04-18;;;
78995271;Финансовый аналитик;Финансовый аналитик;Москва;СТРАТЕГИЯ;;;От 3 до 6 лет;2023-04-06;;200000;RUR
78413920;Финансовый аналитик;Финансовый аналитик (Middle/Senior/Lead);Москва;Тагес Джамп;;финансовый анализ, управленческая отчетность, моделирование, анализ текущих финансовых показателей, финансовая отчетность, business intelligence systems, управленческий учет, финансовый контроль, финансовое планирование, excel, sql, математический склад ума, postgresql, управление финансами, p&l, cash flow, аналитическое мышление, анализ финансовых показателей, подготовка управленческой отчетности, план-фактный анализ бюджета, python, финансовый менеджмент, superset;От 3 до 6 лет;2023-04-17;;;
79226979;Финансовый аналитик;Финансовый менеджер-аналитик;Москва;Миков Александр Вячеславович;;работа в команде, грамотность, умение слушать, хорошая обучаемость, работа в условиях многозадачности, педантичность, работа с большим объемом информации;От 3 до 6 лет;2023-04-12;60000;80000;RUR
77470212;Финансовый аналитик;Финансовый менеджер-аналитик;Москва;Благоустройство Запсиба;;;Более 6 лет;2023-04-11;100000;130000;RUR
78926391;Финансовый аналитик;Финансовый аналитик;Москва;СДЭК;;ms power bi, экономический анализ, power pivot, power query, финансовое планирование, power bi, бюджетирование, управленческий учет, формирование управленческой отчетности, анализ финансовых показателей, работа с большим объемом информации, анализ данных, сбор и анализ информации, финансовый анализ, план-фактный анализ бюджета, анализ продаж;От 3 до 6 лет;2023-04-05;;;
78786742;Финансовый аналитик;Финансовый аналитик;Москва;Кэнди Кэт Рус;;;От 3 до 6 лет;2023-03-31;;;
78886246;Финансовый аналитик;Младший финансовый аналитик (Финансовый департамент Авто);Москва;Avilon Group;;управленческая отчетность, ms powerpoint, финансовая отчетность, планирование, контроль исполнения решений;От 1 года до 3 лет;2023-04-04;90000;90000;RUR
79225579;Финансовый аналитик;Финансовый аналитик;Москва;Биннофарм Групп;;;От 1 года до 3 лет;2023-04-12;;;
79219155;Финансовый аналитик;Старший финансовый аналитик;Москва;РУЛОГ;;;От 3 до 6 лет;2023-04-12;;;
76467587;Финансовый аналитик;Старший финансовый аналитик (Корпоративные финансы);Москва;BAT Russia;;ms excel;От 3 до 6 лет;2023-04-01;161900;;RUR
76762357;Финансовый аналитик;Финансовый аналитик (Дирекция проектов и развития дочерних компании);Москва;Банк ВТБ (ПАО);;ms access, excel, финансовый анализ, финансовый контроль, p&l, менеджмент, аналитическое мышление, проектный менеджмент, конкурентная аналитика, финансы, ms powerpoint, аналитические навыки, деловая коммуникация, умение работать в условиях многозадачности, риск-менеджер, эксперт по стратегии, бизнес-координация дочерних компаний, подготовка аналитики и презентаций по дочерним компаниям;От 3 до 6 лет;2023-04-08;;;
78141200;Финансовый аналитик;Финансовый аналитик;Москва;QIWI;;ms sql, python, sql, power bi, tableau, анализ данных, аналитическое мышление, финансовый анализ, numpy, бизнес-анализ, pandas, data analysis;От 3 до 6 лет;2023-04-06;;;
79107665;Финансовый аналитик;Главный финансовый аналитик в дочернюю компанию банка;Москва;Россельхозбанк;;ms powerpoint, финансовый анализ, подготовка презентаций, анализ данных, работа с большим объемом информации, ms excel;От 3 до 6 лет;2023-04-10;150000;150000;RUR
77996217;Финансовый аналитик;Финансовый аналитик;Москва;ТОП КЕЙС;;анализ бизнес показателей, английский язык, управление проектами, аналитическое мышление, аналитические исследования, инвестиционный анализ, анализ инвестиционных проектов;От 3 до 6 лет;2023-04-06;;;
79158025;Финансовый аналитик;Финансовый аналитик;Москва;SA MEDIA GROUP;;ms powerpoint, google таблицы, excel, google sheets, английский язык (intermediate), формирование отчетности;От 3 до 6 лет;2023-04-11;;;
